{
  "id": "TS-003",
  "category": "Static",
  "targetVerification": "Typecheck (Commit 3)",
  "producedBy": "Mobile Eng",
  "approvedBy": "Reviewer (Illustrative)",
  "lifecycleStatus": "PASSED",
  "gitSha": "829a28c",
  "logDigest": "bda372b43f5e7ab92fd8d6bf1dab9091657b3ca7fbaf6446fc79ec001af74a81",
  "hashVerification": "PASS",
  "sizeFormat": "0.1 KB / log",
  "storageBackendUri": "ImmutableObjectStore / ts-003.log",
  "timestamps": {
    "completed": "2026-08-01T13:55:00Z",
    "approved": "2026-08-01T13:55:05Z"
  },
  "toolVersion": "TS Compiler",
  "runnerOs": "Local / macOS 15",
  "result": "PASS",
  "logReference": "ts-003.log"
}