{
  "id": "ES-001",
  "category": "Static",
  "targetVerification": "ESLint Code Quality",
  "producedBy": "Mobile Eng",
  "approvedBy": "Reviewer (Illustrative)",
  "lifecycleStatus": "PASSED",
  "gitSha": "8b9d5a3",
  "logDigest": "d8f7d84e86fd6cb76f03b78b9d0eae4e8d4a2d2b42f5c0f59b5d1fcbf0d5d7e3",
  "hashVerification": "PASS",
  "sizeFormat": "0.3 KB / log",
  "storageBackendUri": "ImmutableObjectStore / .system_generated/tasks/es-001.log",
  "timestamps": {
    "completed": "2026-08-01T12:50:18Z",
    "approved": "2026-08-01T12:50:22Z"
  },
  "toolVersion": "ESLint 8.57.1",
  "runnerOs": "macOS 15 / Local",
  "result": "PASS",
  "logReference": "eslint 0 errors",
  "dependsOn": [
    "EX-001"
  ]
}