{
  "id": "TS-007",
  "category": "Static",
  "targetVerification": "Typecheck (Commit 7)",
  "producedBy": "Mobile Eng",
  "approvedBy": "Reviewer (Illustrative)",
  "lifecycleStatus": "PASSED",
  "gitSha": "tbd-commit-7",
  "logDigest": "tbd",
  "hashVerification": "PASS",
  "sizeFormat": "0.1 KB",
  "storageBackendUri": "ImmutableObjectStore / ts-007.log",
  "timestamps": {
    "completed": "2026-08-01T15:58:00Z",
    "approved": "2026-08-01T15:58:00Z"
  },
  "toolVersion": "TS Compiler",
  "runnerOs": "Local / macOS 15",
  "result": "PASS",
  "logReference": "ts-007.log",
  "dependsOn": []
}
