{
  "id": "PKG-001",
  "category": "Build",
  "targetVerification": "Shared Package Linking",
  "producedBy": "Mobile Eng",
  "approvedBy": "Reviewer (Illustrative)",
  "lifecycleStatus": "PASSED",
  "gitSha": "f34d12c",
  "logDigest": "13465dc82ddd3930e632782a3c1062cc81f699f79313b72aab83128b8b9190b1",
  "hashVerification": "PASS",
  "sizeFormat": "0.1 KB / log",
  "storageBackendUri": "ImmutableObjectStore / pkg-001.log",
  "timestamps": {
    "completed": "2026-08-01T13:42:00Z",
    "approved": "2026-08-01T13:42:05Z"
  },
  "toolVersion": "npm workspaces",
  "runnerOs": "Local / macOS 15",
  "result": "PASS",
  "logReference": "pkg-001.log"
}