{
  "id": "EX-002",
  "category": "Build",
  "targetVerification": "TypeScript Strict Mode",
  "producedBy": "Mobile Eng",
  "approvedBy": "Reviewer (Illustrative)",
  "approvalSignature": "IdP-SSO / Sig-7c6d...",
  "lifecycleStatus": "PASSED",
  "gitSha": "1334067",
  "logDigest": "f1d1926c33bc391361207d8666c73537409258cadf2e0a9371d5f20fefa9450c",
  "hashVerification": "PASS",
  "sizeFormat": "0.6 KB / json",
  "storageBackendUri": "ImmutableObjectStore / Esparex-RN/tsconfig.json",
  "timestamps": {
    "completed": "2026-08-01T12:31:05Z",
    "approved": "2026-08-01T12:31:10Z"
  },
  "toolVersion": "TS 5.3.3 / Expo Base",
  "runnerOs": "Local / macOS 15",
  "result": "PASS",
  "logReference": "Esparex-RN/tsconfig.json"
}
