{
  "id": "SS-001",
  "category": "Runtime",
  "targetVerification": "Hardware-backed SecureStore availability verified",
  "producedBy": "Mobile Eng",
  "approvedBy": "Reviewer (Illustrative)",
  "lifecycleStatus": "PASSED",
  "gitSha": "tbd-commit-4",
  "logDigest": "tbd",
  "hashVerification": "PASS",
  "sizeFormat": "0.1 KB",
  "storageBackendUri": "ImmutableObjectStore / ss-001.log",
  "timestamps": {
    "completed": "2026-08-01T14:25:00Z",
    "approved": "2026-08-01T14:25:00Z"
  },
  "toolVersion": "Expo SecureStore",
  "runnerOs": "Local / macOS 15",
  "result": "PASS",
  "logReference": "ss-001.log",
  "dependsOn": []
}
