{
  "id": "PKG-003",
  "category": "Runtime",
  "targetVerification": "Runtime Shared Imports",
  "producedBy": "Mobile Eng",
  "approvedBy": "Reviewer (Illustrative)",
  "lifecycleStatus": "PASSED",
  "gitSha": "f34d12c",
  "logDigest": "4b913c0c407afaf15fb3d3033735da29551c969382446049e07232b3979f6503",
  "hashVerification": "PASS",
  "sizeFormat": "0.1 KB / log",
  "storageBackendUri": "ImmutableObjectStore / pkg-003.log",
  "timestamps": {
    "completed": "2026-08-01T13:42:00Z",
    "approved": "2026-08-01T13:42:05Z"
  },
  "toolVersion": "tsx runtime",
  "runnerOs": "Local / macOS 15",
  "result": "PASS",
  "logReference": "pkg-003.log"
}