{
  "id": "API-001",
  "category": "Runtime",
  "targetVerification": "API Client Infrastructure Configuration",
  "producedBy": "Mobile Eng",
  "approvedBy": "Reviewer (Illustrative)",
  "lifecycleStatus": "PASSED",
  "gitSha": "tbd-commit-5",
  "logDigest": "tbd",
  "hashVerification": "PASS",
  "sizeFormat": "0.1 KB",
  "storageBackendUri": "ImmutableObjectStore / api-001.log",
  "timestamps": {
    "completed": "2026-08-01T14:35:00Z",
    "approved": "2026-08-01T14:35:00Z"
  },
  "toolVersion": "Axios / Jest",
  "runnerOs": "Local / macOS 15",
  "result": "PASS",
  "logReference": "api-001.log",
  "dependsOn": ["UT-005"]
}
